questions,classes
What does an irate car owner call iron oxide ? ~ You # does What # call an irate car owner # does call iron oxide,ENTY
"Of children between the ages of two and eleven , what percentage watch `` The Simpsons '' ? ~ You # watch what percentage",NUM
What 's the northernmost U.S. state apart from Alaska ? ~ What 's # 's the northernmost U.S. state,LOC
Name an art gallery in New York . ~ You # Name an art gallery in,LOC
Who sells Viagra ? ~ Who sells # sells Viagra,HUM
What musical instrument did Prewitt play in James Jones 's From Here to Eternity ? ~ You # play What musical instrument # play Prewitt,ENTY
What is the Home Rule Act ? ~ What is # is the Rule Act,DESC
What building are British monarchs crowned in ? ~ You # are What building # crowned British monarchs,LOC
What are Bellworts ? ~ What are # are Bellworts,DESC
Who was Darius ? ~ Who was,HUM
What movie told of Anna Anderson 's claim to be a Russian czar 's daughter ? ~ You # told What movie,ENTY
Who did Dita Beard work for ? ~ Who for # work Dita Beard,HUM
What kind of creature is a coot ? ~ You,ENTY
Name the university of which Woodrow Wilson was president . ~ You # Name the university was # was Woodrow Wilson,HUM
"What country was first to use the airplane as a weapon of war , against the Turks in Libya ? ~ You # was What country # use the airplane",LOC
What university was Woodrow Wilson President of ? ~ You,HUM
What is a fear of disease ? ~ What is # is a fear of,ENTY
What kind of meat is Fray Bentos synonymous with ? ~ You,ENTY
What did Mr. Magoo flog on TV for General Electric ? ~ What did # did Magoo flog on,ENTY
What are the words to the Canadian National anthem ? ~ What are # are the words to,DESC
What is the name of the Jewish alphabet ? ~ What is # is the name of,ENTY
Who served as inspiration for the schoolteacher portrayed by Robin Williams in `` Dead Poets Society '' ? ~ Who served,HUM
What is Columbia Tristar 's phone number ? ~ What is # is Tristar phone number,NUM
Name the five positions who are in the line of succession to the presidency . ~ You # Name the five positions are # are who,HUM
Which one of the original seven Mercury program astronauts did not fly on any of the Mercury flights ? ~ You # fly Which one of,HUM
Who is the best known villain of the 165 Gunpowder Plot ? ~ Who is,HUM
What is the capital of Burkina Faso ? ~ What is # is the capital of,LOC
What continent is Bolivia on ? ~ You,LOC
Why was Muhammad Ali stripped of his title and barred from boxing in 1967 ? ~ Why stripped # stripped Muhammad Ali,DESC
"Who killed more people , Hitler or Stalin ? ~ Who killed # killed more people , Hitler",HUM
What caused Shea & Gould to close their L.A. office ? ~ You # caused What # close Shea & Gould # close their L.A. office,DESC
What 's the only mammal that can 't jump ? ~ What 's # 's the only mammal jump # jump that # jump t,ENTY
What U.S. state has the most blondes ? ~ You # has What # has U.S. state # has the most blondes,LOC
What war saw battles at Parrot 's Beak and Black Virgin ? ~ You # saw What war # saw battles at,ENTY
What was the U.S. highway death toll in 1969 ? ~ What was # was the U.S. death toll in,NUM
What does the name Kelly mean ? ~ You # mean What # mean the name # mean Kelly,DESC
What is a phalanx ? ~ What is # is a phalanx,DESC
What mustachioed comedian portrayed Frankie in North to Alaska ? ~ You # portrayed What mustachioed comedian # portrayed Frankie,HUM
What does each of the utilities cost in Monopoly ? ~ You # each What,NUM
"What actor and World War II airman had a $5 , 0 bounty put on his head by Hermann Goering ? ~ You # had actor airman # had a 5 , 0 bounty put",HUM
What does e.g. stand for ? ~ You,ABBR
What is the name of the medical condition in which a baby is born without a brain ? ~ What is # is the name of,ENTY
How do storms form ? ~ How storms # storms form,DESC
Who is Nicolo Paganini ? ~ Who is,HUM
What city is often called The Insurance Capital of the World ? ~ You # called The Insurance Capital of,LOC
What are the three animals in Sheila Burnford 's The Incredible Journey ? ~ What are # are the three animals in,ENTY
Who portrayed Dracula in Hammer Studios ' films ? ~ Who portrayed # portrayed Dracula,HUM
Name one of the Seven Wonders of the Ancient World . ~ You # Name one of,ENTY
When were fish first believed to be found on earth ? ~ When believed # believed fish,NUM
"What President 's favorite Biblical quotation was : `` Come now , and let us reason together '' . ~ What was # was President favorite Biblical quotation # reason us",HUM
How many elevators do you ride to reach the top floor of the Empire State Building ? ~ How many # ride many elevators # ride you # reach the top floor of,NUM
Name the food company that traveled to Soviet Georgia to film a series of ads . ~ You # Name the food company traveled # traveled that # film a series of,HUM
What country was Sir Edmund Hillary born in ? ~ You # was What country # born Sir Edmund Hillary,LOC
What 's an infant seal called ? ~ What 's # 's an infant seal called,ENTY
"What was the proper Laugh-In respones to : `` Say goodnight , Dick '' ? ~ What was # was respones to # Say goodnight",DESC
What city was John F. Kennedy nominated for president in ? ~ You # nominated John F. Kennedy,LOC
How long does a dog sleep ? ~ How long,NUM
What 1963 Joseph L. Mankiewicz film cost $28 million ? ~ You # cost Mankiewicz film # cost $ 28 million,ENTY
What Japanese electronics company was named for a coastal city northeast of Tokyo ? ~ You # named What,HUM
What can you be fined for having a dog on a beach ? ~ You # having a dog on,NUM
Where did the Battle of the Bulge take place ? ~ Where take # take the Battle of # take place,LOC
How much will the California be in the year 2000 ? ~ How much # be the California,NUM
"What mystery writer penned `` ...the glory that was Greece , and the grandeur that was Rome '' ? ~ You # penned What mystery writer # penned ... the glory was , and grandeur '' # was that # was that",HUM
What state full of milk and honey was the destination in The Grapes of Wrath ? ~ You # was What state full,LOC
What is the tallest building in Japan ? ~ What is # is the tallest building in,LOC
Where is Sinn Fein 's headquarters ? ~ Where is # is Fein headquarters,LOC
Name Li 'l Abner 's favorite Indian drink . ~ You,ENTY
What are some important events of the 1830 's ? ~ What are # are some important events of,ENTY
The Iraqis launched their attack on Kuwait on what day ? ~ You # launched The Iraqis # launched their attack on,NUM
What letter adorns the flag of Rwanda ? ~ You # adorns What letter # adorns the flag of,ENTY
"What did 8 , CD NNS VBP TO VB NNP POS NN . ~ You # did What",ENTY
What is God ? ~ What is # is God,DESC
What country 's northernmost city is Darwin ? ~ You # is country northernmost city,LOC
"What sound does Olympia , Washington , overlook ? ~ You # does Olympia , Washington",LOC
What TV show chronicled the lives of Katy Holstrum and Congressman Glen Morley ? ~ You # chronicled What # chronicled TV show # chronicled the lives of,ENTY
What Kentucky city calls itself The Horse Center of America ? ~ You # calls What # calls Kentucky city # calls itself # calls The Horse Center of,LOC
How many penny-farthings are there on a Trivial Pursuit game board ? ~ How many # are many penny - farthings,NUM
What 's the most abundant element in the sun ? ~ What 's # 's the abundant element in,ENTY
"What European country boasts the city of Furth , found where the rivers Rednitz and Pegnitz converge ? ~ You # boasts What # boasts European country # boasts the city of # converge the rivers Rednitz",LOC
What U.S. state is Dixville Notch in ? ~ What is # is U.S. state # Notch Dixville,LOC
"Where was the Cisalpine Republic , 1797-185 , ? ~ Where was # was the Cisalpine Republic , 1797 ,",LOC
What is the largest shopping mall in the world ? ~ What is # is the largest shopping mall in,LOC
What is the protagonist 's name in Dostoevski 's `` The Idiot '' ? ~ What is # is protagonist name in,HUM
What penalty space lies between Baltic Avenue and Reading Railroad on a Monopoly board ? ~ You # lies What penalty space,ENTY
What presidential press secretary dismissed Watergate as a third-rate burglary attempt ? ~ You # dismissed What presidential press secretary # dismissed Watergate,HUM
What is a meerkat ? ~ What is # is a meerkat,DESC
Who was Jean Nicolet ? ~ Who was,HUM
What kind of animal was Winnie the Pooh ? ~ You,ENTY
Which of these are authors ? ~ You # are Which of,HUM
What 's the international radio code word for the letter B ? ~ What 's # 's the international code word for,ENTY
Who was the original Humpty Dumpty ? ~ Who was # was the original Humpty Dumpty,HUM
What is cache memory ? ~ What is # is cache memory,DESC
Aspartame is also known as what ? ~ You,ENTY
Where is the location of the Orange Bowl ? ~ Where is # is the location of,LOC
When is President Nixon 's birthday ? ~ When is # is Nixon birthday,NUM
"What is the origin of the midwest slang , ` you 're darn tootin ' ? ~ What is # is the origin of # 're you # is you 're tootin",DESC
Whose cupboard was bare ? ~ You # was Whose cupboard,HUM
What are the seven seas ? ~ What are # are the seven seas,LOC
What does IBM stand for ? ~ You # stand IBM,ABBR
What is the difference between jazz and blues ? ~ What is # is the difference between,DESC
What is the C programming language ? ~ What is # is the programming language,DESC
What 's the name of Popeye 's adopted son ? ~ What 's # 's the name of,HUM
Who invented the vacuum cleaner ? ~ Who invented # invented the vacuum cleaner,HUM
What is a ` borrow pit ' ? ~ What is # borrow pit,DESC
What 2th-century fictional character attends Pencey Prep School ? ~ You # attends What century fictional character # attends Pencey Prep School,HUM
How many people in the USA say their number one source of information is the newspaper ? ~ How many # say many people in # is their number source of,NUM
"Who does Shakespeare 's Antonio borrow 3 , 0 ducats from ? ~ Who borrow # borrow Shakespeare Antonio # borrow 3 ducats from",HUM
Which country is known as `` Big Bear '' ? ~ You,LOC
"What `` melts in your mouth , not in your hands '' . ~ You",ENTY
How many times a day should you take a prescription marked `` q.i.d . '' ? ~ How many # take you # take a prescription marked # marked ` ` q.i.d,NUM
What is the origin of the atom ? ~ What is # is the origin of,DESC
Who is the Voyager project manager ? ~ Who is # is the Voyager project manager,HUM
Which radio stations air the Jim Bohannon Radio Talk Show ? ~ You # air Which radio stations # air the Bohannon Radio Talk Show,HUM
What two commanders directed the forces in the Battle of El Alamein ? ~ You # directed What # directed two commanders # directed the forces in,HUM
Name the creator of `` The Muppets '' . ~ You # Name the creator of,HUM
How do I e-mail someone at aol.com from yahoo.com ? ~ How mail # mail I e - # mail someone at from,DESC
Who replies `` I know '' to Princess Leia 's confession `` I love you '' in The Empire Strikes Back ? ~ Who replies # know I # love I # love you,HUM
What is the meaning of the name Ella ? ~ What is # is the meaning of,DESC
What 's the home of the Rockettes ? ~ What 's # 's the home of,LOC
"Where can I find all the information I need to know about the English Civil War , 1642-1649 , ? ~ Where find # find I # find all the information need # need I",LOC
What is the name of the firm that makes Spumante ? ~ What is # is the name of # makes that # makes Spumante,HUM
What sport is played on the largest field ? ~ You,ENTY
Who won the 1967 Academy Award for Best Actor ? ~ Who won # won the 1967 Academy Award,HUM
What is after death ? ~ What is,ENTY
Name the first private citizen to fly in space . ~ You # Name the first private citizen,HUM
What was football star Elroy Hirsch 's nickname ? ~ What was # was Hirsch nickname,HUM
What singer sings `` Oh Boy '' ? ~ You # sings What singer # sings ` Oh Boy,HUM
How much pizza do Americans eat in a day ? ~ How much # eat much pizza # eat Americans,NUM
What is the website for the USA journal ? ~ What is # is the website for,LOC
What army 's motto is Blood and Fire ? ~ You # is army motto,HUM
What kind of patent did Ermal Fraze get in 1963 ? ~ You # get What kind of # get Ermal Fraze,ENTY
What are you hearing when you put a seashell to your ear ? ~ You # hearing What # hearing you # put you # put a seashell,DESC
Why are haunted houses popular ? ~ Why haunted # haunted houses popular,DESC
Which gender has bigger thighs ? ~ You # has Which gender # has bigger thighs,ENTY
What U.S. state has the second-longest coastline ? ~ You # has What # has U.S. state # has the longest coastline,LOC
What state 's home to the Buffalo Bill Historical Center ? ~ You,LOC
How fast do cheetahs run ? ~ How fast # run cheetahs,NUM
What is Ray Bradbury 's illustrated man illustrated with ? ~ What is # illustrated Bradbury illustrated man,ENTY
How fast is a 45Mhz processor ? ~ How fast # is a 45Mhz processor,NUM
"What kind of puzzle first appeared in the U.S. in the New York World on December 21 , 1913 ? ~ You # appeared What kind of",ENTY
What count did Alexandre Dumas write about ? ~ You # write What count # write Alexandre Dumas,HUM
What are the odds of giving birth to twins ? ~ What are # are the odds of # giving birth,NUM
What is the largest natural lake in Pennsylvania ? ~ What is # is the largest natural lake in,LOC
How far is London UK from California ? ~ How far # is London UK from,NUM
Name the two mystical ravens Odin has at his command . ~ You # Name the two mystical ravens has # has Odin,ENTY
What was the species of Winnie the Pooh ? ~ What was # was the species of,ENTY
What is the virus HIV ? ~ What is # is the virus HIV,DESC
How many years old is Benny Carter ? ~ How many,NUM
What Hermann Hesse book gave its name to a rock group ? ~ You # gave What # gave Hesse book # gave its name,ENTY
Where does the Santa Fe Trail begin and end ? ~ Where begin # begin the Fe Trail,LOC
What book is the follow-up to Future Shock ? ~ You,ENTY
What African animals are known as The Big Five ? ~ You # known What,ENTY
What is the alphabet for Latin ? ~ What is # is the alphabet for,ENTY
What is the fear of frogs ? ~ What is # is the fear of,ENTY
Which city in Canada is the least-populated ? ~ You # is Which city in,LOC
How old is Stevie Wonder ? ~ How old # is Stevie Wonder,NUM
Who was the first Taiwanese President ? ~ Who was # was the first Taiwanese President,HUM
Who is Luke Skywalker 's father ? ~ Who is # is Skywalker father,HUM
What does a dipsomaniac crave ? ~ You # crave What # crave a dipsomaniac,ENTY
What is the definition of the term `` weapons system '' ? ~ What is # is the definition of,DESC
What are Christopher Marlowe 's and Shakespeare 's literary contributions to English literature ? ~ What are # are Christopher Marlowe 's and contributions,DESC
What is Nero Wolfe 's favorite drink during office hours ? ~ What is # is Wolfe favorite drink during,ENTY
What is the first personal computer company ? ~ What is # is the first personal computer company,HUM
What is the most efficient way to start a barbeque ? ~ What is # is the efficient way start # start a barbeque,ENTY
Who was Jane Goodall ? ~ Who was,HUM
Why are there Braille things on the ATM machines that people drive through ? ~ Why are # drive people,DESC
Where is the Isle of Man ? ~ Where is # is the Isle of,LOC
What book did Aaron Hass write ? ~ You # write What book # write Aaron Hass,ENTY
What was the death toll at the eruption of Mount Pinatubo ? ~ What was # was the death toll at,NUM
When will the millennium officially begin ? ~ When begin # begin the millennium,NUM
"Who created the comic strip , `` Garfield '' ? ~ Who created # created the comic strip # created ` Garfield ''",HUM
Which Vietnamese terrorist is now a UN delegate in Doonesbury ? ~ You # is Which Vietnamese terrorist,HUM
What is real time processing ? ~ You # is What # is time processing,DESC
What do we call the imaginary line along the top of the Rocky Mountains ? ~ You # call What # call we # call the imaginary line along,LOC
What country 's capital is Lagos ? ~ You # is country capital,LOC
Where does Ray Bradbury 's Chronicles take place ? ~ Where take # take Bradbury Chronicles # take place,LOC
Who is the current prime minister and president of Russia ? ~ Who is # is the current prime minister and president,HUM
Who established a Viking colony in Greenland about 985 ? ~ Who established # established a Viking colony,HUM
What was the distinguishing mark on the `` Little Rascals '' dog ? ~ What was # was the distinguishing mark on,ENTY
"What is the latitude and longitude of El Paso , Texas ? ~ What is # is the latitude and longitude of",NUM
Where can I get information about cystic fibrosis ? ~ Where get # get I # get information about,LOC
Where did Honecker rule ? ~ Where rule # rule Honecker,LOC
What is the theory of equivalence states ? ~ What is # is the theory of,DESC
What does a philatelist collect ? ~ You # collect What,ENTY
What is the life span of the average monkey ? ~ What is # is the life span of,NUM
How many member states are in the UN ? ~ How many # are many member states,NUM
Who shot and killed himself while painting Wheatfield with Crows ? ~ Who shot # killed himself # painting Wheatfield,HUM
What will happen when sodium is put in water ? ~ You # happen What,DESC
What 's the meaning of UOL ? ~ What 's # 's the meaning of,DESC
What future President became Senate majority whip under Harry Truman ? ~ You # became future President,HUM
Who was the architect of Central Park ? ~ Who was # was the architect of,HUM
Which operating system runs on IBM-compatible machines ? ~ You # runs Which operating system,ENTY
What are the dimensions of an ice hockey goal ? ~ What are # are the dimensions of,NUM
When was CNN 's first broadcast ? ~ When was # was CNN first broadcast,NUM
What are the signs of a country going into a recession ? ~ What are # are the signs of,ENTY
What is the circumorbital hematoma ? ~ What is # is the circumorbital hematoma,DESC
What African country is governed from Ouagadougou ? ~ You # governed What,LOC
What was the Christian name of the title character in Our Miss Brooks ? ~ What was # was the Christian name of in,HUM
What hard-of hearing artist painted Sunflowers ? ~ You # painted What hard # painted hearing artist # painted Sunflowers,HUM
Who were the Yankee 's frequent enemies ? ~ Who were,HUM
Who wrote Sons and Lovers ? ~ Who wrote # wrote Sons and Lovers,HUM
What is the English translation for the word `` caliente '' ? ~ What is # is the English translation for,ENTY
What handicraft requires you to interlace your warp and weft ? ~ You # requires What handicraft # requires you # interlace your warp and weft,ENTY
What French seaport claims to be The Home of Wines ? ~ You # claims What French seaport,LOC
How long does it take sunlight to reach Earth ? ~ How long # take it # take sunlight # reach Earth,NUM
How many milliseconds in a second ? ~ How many,NUM
What Cherokee Indian gave his name to a tree ? ~ You # gave What # gave Cherokee Indian # gave his name,HUM
When were camcorders introduced in Malaysia ? ~ When were # introduced camcorders,NUM
What is the chance of conceiving quadruplets ? ~ What is # is the chance of # conceiving quadruplets,NUM
Who was the star of Leave It to Beaver ? ~ Who was # was the star of to # Leave It,HUM
What countries have the largest armed forces in the world ? ~ You # have What countries # have the largest armed forces in,LOC
What was William F. Cody 's better-known name ? ~ What was # was Cody known name,HUM
How do I increase my biceps ' size ? ~ How increase # increase I # increase biceps size,DESC
Who did Richard Nixon tender his resignation to ? ~ Who tender # tender Richard Nixon # tender his resignation,HUM
Who was Thucydides ? ~ Who was,HUM
How is the element strontium purified ? ~ How purified # purified the element strontium,DESC
Which of the following rock 'n roll stars has a `` star '' on Hollywood Boulevard ? ~ You # has Which of # has a ` ` star '' on,HUM
What are tonsils for ? ~ What are # are tonsils for,DESC
"What molecules include fluorine , sodium and magnesium ? ~ You # include molecules # include fluorine , sodium",ENTY
What was the name of the ball game played by the mayans ? ~ What was # was the name of,ENTY
What was the sequel to The Moon 's Balloon ? ~ What was # was the sequel to,ENTY
What is the exchange rate for Australian to American money ? ~ What is # is the exchange rate for to,NUM
What is the origin of the word ` posh ' ? ~ What is # is the origin of ` posh,DESC
How can anyone tell if a female had sexual intercourse ? ~ How tell # tell anyone # had a female # had sexual intercourse,DESC
How many states did Richard Nixon carry in 1972 ? ~ How many # did many states # carry Richard Nixon,NUM
What basketball maneuver did Bert Loomis invent ? ~ You # did What basketball maneuver # invent Bert Loomis,ENTY
What is a good book to read for people who hate to read ? ~ What is # is a good book read # hate who,ENTY
How many shillings more than 2 were there in a guinea ? ~ How many # were more than 2,NUM
What does a tarantula eat ? ~ You # eat What # eat a tarantula,ENTY
What are the three secondary colors ? ~ What are # are the three secondary colors,ENTY
What does the name `` Sabrina '' mean ? ~ You # mean What # mean the name Sabrina,DESC
Who took over as conductor of the Boston Pops after Arthur Fiedler 's long reign ? ~ Who took,HUM
What were the trials called which followed World War II ? ~ What were # were the trials called followed # followed which # followed World War II,ENTY
What is hebephrenia ? ~ What is # is hebephrenia,DESC
What Nazi leader killed himself in jail just before he was to be executed as a war criminal ? ~ You # killed What # killed Nazi leader # killed himself # was he,HUM
What famous events have happened on March 27 ? ~ You # happened What famous events,ENTY
Which company claimed to be `` the world 's biggest toy store '' ? ~ You # claimed Which company,HUM
What brand number graces the black label of a bottle of Jack Daniel 's ? ~ You # graces brand number # graces the black label of,NUM
What do I call the sons and daughters of my first cousins ? ~ You # call What # call I # call the sons and daughters of,ENTY
What were the causes of the Civil War ? ~ What were # were the causes of,DESC
What are Maid-Rites ? ~ What are,DESC
What city is terrorized by Dracula in The Night Stalker ? ~ You,LOC
How can you prevent it ? ~ How prevent # prevent you # prevent it,DESC
What do the names Andrew and Christina mean ? ~ You # mean What # mean the names Andrew,DESC
What chocolate bar created by Frank Mars and his wife is often called a Milky Way with peanuts ? ~ You # called a Milky Way,ENTY
Who is the fastest guitarist ? ~ Who is # is the fastest guitarist,HUM
What do camels store in their humps ? ~ You # store What,ENTY
What is the name of the second space shuttle ? ~ What is # is the name of,ENTY
What is the best hospital for orthopedics in the country ? ~ What is # is the best hospital for,LOC
What are perfect tenses ? ~ What are # are perfect tenses,DESC
What is commonly considered the fifth sense ? ~ You # considered the fifth sense,DESC
What was another name for East Germany ? ~ What was # was another name for,ENTY
What 's the second-biggest-selling magazine in America ? ~ What 's # 's the selling magazine in,ENTY
Who betrayed Norway to the Nazis ? ~ Who betrayed # betrayed Norway,HUM
Who took the toys donated for the Doodyville Orphans ' Fund and kept them for himself ? ~ Who took # took the toys donated # kept them,HUM
What is a bourdon tube ? ~ What is # is a bourdon tube,DESC
What kind of a sports team is the Wisconsin Badgers ? ~ You,ENTY
Who were the Picts ? ~ Who were # were the Picts,HUM
"What do Caroll Baker , Tammy Grimes , Debbie Reynolds , and Judy Garland all have in common ? ~ You # have What # have Caroll Baker , Grimes Garland",DESC
What is film noir ? ~ What is # is film noir,DESC
Who is stationed at Camp Swampy in the comic strips ? ~ Who stationed,HUM
In what year did China and the Republic of Korea establish diplomatic relations ? ~ You # establish China and Republic # establish diplomatic relations,NUM
What causes tuberculosis ? ~ You # causes What # causes tuberculosis,DESC
How tall is the giraffe ? ~ How tall # is the giraffe,NUM
What actor dressed up as Santa Claus and had a once-a-year affair with actress Shelley Winters every Christmas for many years ? ~ You # dressed What actor # had a once affair with,HUM
What animal was the heat-seeking missile called the Sidewinder named for ? ~ You # called the Sidewinder,ENTY
How long did it take Stanley to find Livingstone ? ~ How long # take it # take Stanley # find Livingstone,NUM
How much of the nation 's children between the ages of two and eleven watch ` The Simpsons ' ? ~ How much,NUM
What lake is Sheboygan on ? ~ You # is Sheboygan,LOC
What are a baseball team 's firemen ? ~ What are # are team firemen,DESC
What is a fear of color ? ~ What is # is a fear of,ENTY
What Nantucket shipwreck killed more divers exploring it than the 52 people it sank with ? ~ You # killed What # killed Nantucket shipwreck # killed more divers exploring # exploring it # sank it,ENTY
What are the two largest birds on earth ? ~ What are # are the two largest birds on,ENTY
Name the four stories contained in Edith Wharton 's `` Old New York . '' ~ You # Name the four stories contained,ENTY
What is the largest lake in North America ? ~ What is # is the largest lake in,LOC
How many people died because of a smoking problem in 1997 ? ~ How many # died many people,NUM
What is chronic constipation a symptom of ? ~ You # is What # is chronic constipation,ENTY
Who wrote The Look of Love after viewing Ursula Andress ? ~ Who wrote # wrote The Look of # viewing Ursula Andress,HUM
