questions,classes
How did serfdom develop in and then leave Russia ? ~ How develop # develop serfdom # leave Russia,DESC
What films featured the character Popeye Doyle ? ~ You # featured What films # featured the character Doyle,ENTY
How can I find a list of celebrities ' real names ? ~ How find # find I # find a list of,DESC
What fowl grabs the spotlight after the Chinese Year of the Monkey ? ~ You # grabs What fowl # grabs the spotlight,ENTY
What is the full form of .com ? ~ What is # is the full form of,ABBR
What contemptible scoundrel stole the cork from my lunch ? ~ You # stole What contemptible scoundrel # stole the cork,HUM
What team did baseball 's St. Louis Browns become ? ~ You # did What team # become baseball Louis Browns,HUM
What is the oldest profession ? ~ What is # is the oldest profession,HUM
What are liver enzymes ? ~ What are # are liver enzymes,DESC
Name the scar-faced bounty hunter of The Old West . ~ You # Name the faced bounty hunter of,HUM
When was Ozzy Osbourne born ? ~ When was # born Ozzy Osbourne,NUM
Why do heavier objects travel downhill faster ? ~ Why travel # travel heavier objects,DESC
Who was The Pride of the Yankees ? ~ Who was,HUM
Who killed Gandhi ? ~ Who killed # killed Gandhi,HUM
What is considered the costliest disaster the insurance industry has ever faced ? ~ You # considered the costliest disaster faced # faced the insurance industry,ENTY
What sprawling U.S. state boasts the most airports ? ~ You # boasts What sprawling U.S. state # boasts the most airports,LOC
What did the only repealed amendment to the U.S. Constitution deal with ? ~ You # deal the only repealed amendment to,DESC
How many Jews were executed in concentration camps during WWII ? ~ How many,NUM
What is `` Nine Inch Nails '' ? ~ You # is What,DESC
What is an annotated bibliography ? ~ What is # is an annotated bibliography,DESC
What is the date of Boxing Day ? ~ What is # is the date of,NUM
What articles of clothing are tokens in Monopoly ? ~ You # are What articles of,ENTY
Name 11 famous martyrs . ~ You # Name 11 famous martyrs,HUM
What 's the Olympic motto ? ~ What 's # 's the Olympic motto,DESC
What is the origin of the name ` Scarlett ' ? ~ What is # is the origin of Scarlett,DESC
What 's the second-most-used vowel in English ? ~ What 's # 's the used vowel in,ENTY
Who was the inventor of silly putty ? ~ Who was # was the inventor of,HUM
What is the highest waterfall in the United States ? ~ What is # is the highest waterfall in,LOC
Name a golf course in Myrtle Beach . ~ You # Name a golf course in,ENTY
Which two states enclose Chesapeake Bay ? ~ You # enclose Which two states # enclose Chesapeake Bay,LOC
What does the abbreviation AIDS stand for ? ~ You # does What # does the abbreviation stand # stand AIDS,ABBR
What does a spermologer collect ? ~ You # collect What,ENTY
How many points make up a perfect fivepin bowling score ? ~ How many # make many points # make a perfect fivepin bowling score,NUM
Which company that manufactures video-game hardware sells the `` super system '' ? ~ You # sells Which company manufactures # manufactures that # manufactures game hardware # sells the ` ` super system '',HUM
How many Community Chest cards are there in Monopoly ? ~ How many # are many Chest cards,NUM
What do Mormons believe ? ~ You # believe What # believe Mormons,DESC
When did the neanderthal man live ? ~ When live # live the neanderthal man,NUM
In what religion was Isis the nature goddess ? ~ You # was Isis,ENTY
Where do the adventures of `` The Swiss Family Robinson '' take place ? ~ Where take # take the adventures of # take place,LOC
What relative of the racoon is sometimes known as the cat-bear ? ~ You,ENTY
How can I register my website in Yahoo for free ? ~ How register # register I # register my website,DESC
What was cash-conscious Colonel Edwin L. Drake the first to drill ? ~ What was # was conscious Colonel Edwin L. Drake,ENTY
How many people in the world speak French ? ~ How many # speak many people in # speak French,NUM
How many inches over six feet is the Venus de Milo ? ~ How many # is many inches feet,NUM
How do they find or choose witnesses to an execution ? ~ How find # find they # choose witnesses,DESC
What 1920s cowboy star rode Tony the Wonder Horse ? ~ You # rode What # rode 1920s cowboy star,HUM
What cocktail inspired John Doxat to write the book Stirred-Not Shaken ? ~ You # inspired What cocktail # inspired John Doxat # write the book # write Stirred Shaken,ENTY
What ISPs exist in the Caribbean ? ~ You # exist What # exist ISPs,HUM
How do you ask a total stranger out on a date ? ~ How ask # ask you # ask a total stranger,DESC
What weapon is the mythological character Apollo most proficient with ? ~ You,ENTY
What country do the Galapagos Islands belong to ? ~ You # belong the Galapagos Islands,LOC
What is ethology ? ~ What is # is ethology,DESC
Who was the prophet of the Muslim people ? ~ Who was # was the prophet of,HUM
Where did the term `` 86ed '' come from ? ~ You # come the term 86ed,DESC
Who is Snoopy 's arch-enemy ? ~ Who is,HUM
What is the nature of learning ? ~ What is # is the nature of,DESC
What 's the only color Johnny Cash wears on stage ? ~ What 's # 's the color Cash wears on,ENTY
What 's the term for a young fox ? ~ What 's # 's the term for,ENTY
What U.S. state lived under six flags ? ~ You # lived What # lived U.S. state,LOC
What is the Kashmir issue ? ~ What is # is the Kashmir issue,DESC
Where is the Loop ? ~ Where is # is the Loop,LOC
What does `` extended definition '' mean and how would one write a paper on it ? ~ You # definition What # mean What does ` ` extended definition '' # write one # write a paper,DESC
What country 's capital is Tirana ? ~ You # is country capital,LOC
What is titanium ? ~ What is # is titanium,DESC
Who do Herb and Tootsie live next door to ? ~ Who do # live Herb and Tootsie,HUM
Which city has the oldest relationship as a sister city with Los Angeles ? ~ You # has Which city # has the oldest relationship as,LOC
What is a caldera ? ~ What is # is a caldera,DESC
Why do people get calluses ? ~ Why get # get people # get calluses,DESC
What are the names of the tourist attractions in Reims ? ~ What are # are the names of,LOC
What are Cushman and Wakefield known for ? ~ What are # known Cushman and Wakefield,DESC
What body of water does the Danube River flow into ? ~ You # flow What body of # flow the Danube River,LOC
Who is the founder of Scientology ? ~ Who is # is the founder of,HUM
What does the six-footed Musca domestica become when it enters a house ? ~ You # become What # become the footed Musca domestica # enters it # enters a house,ENTY
What is the history of skateboarding ? ~ What is # is the history of,DESC
Who starred in Singing in the Rain and The Singing Nun ? ~ Who starred,HUM
How do I make fuel bricks from recycled newspaper ? ~ How make # make I # make fuel bricks,DESC
What 19th-century painter died in the Marquesas Islands ? ~ You # died What century painter,HUM
The corpus callosum is in what part of the body ? ~ You # is The corpus callosum,ENTY
How do I log on to home page at Headquarters U.S. European Command ? ~ How log # log I,DESC
"What country did the Nazis occupy for 1 , CD NNS IN NNP NNP NNP . ~ You # occupy What country # occupy the Nazis",LOC
What is Nebraska 's most valuable resource ? ~ What is # is Nebraska valuable resource,ENTY
How many species of the Great White shark are there ? ~ How many # are many species of,NUM
What is the origin of head lice ? ~ What is # is the origin of,DESC
What is the nickname for the state of Mississippi ? ~ What is # is the nickname for,LOC
What was the first domesticated bird ? ~ What was # was the domesticated bird,ENTY
How many villi are found in the small intestine ? ~ How many,NUM
What country did King Wenceslas rule ? ~ You # did What country # rule King Wenceslas,LOC
What is a fear of shadows ? ~ What is # is a fear of,ENTY
Who were the five Marx brothers ? ~ Who were,HUM
In which year was New Zealand excluded from the ANZUS alliance ? ~ You # excluded New Zealand,NUM
When did CNN begin broadcasting ? ~ When begin # begin CNN,NUM
What causes the body to shiver in cold temperatures ? ~ You # causes What # shiver the body,DESC
What are bear and bull markets ? ~ What are # are bear markets,DESC
What J.R.R. Tolkien book features Bilbo Baggins as the central character ? ~ You # features What # features Tolkien book # features Bilbo Baggins,ENTY
What is `` dew point '' ? ~ You # is What # is ` ` dew point '',DESC
What is the meaning of Jesus ? ~ What is # is the meaning of,DESC
What company 's logo is a `` W '' in a circle ? ~ You # is company logo,HUM
What is the definition of a cascade ? ~ What is # is the definition of,DESC
When did Rococo painting and architecture flourish ? ~ When flourish # painting Rococo # flourish Rococo painting and architecture,NUM
What country 's national passenger rail system is called Via ? ~ You # called Via,LOC
Who invented Make-up ? ~ Who invented # invented Make - up,HUM
What is the origin of the word `` attic '' ? ~ What is # is the origin of,DESC
What did Delilah do to Samson 's hair ? ~ You # do What # do Delilah,DESC
What kind of animals were in the Paleozoic era ? ~ You,ENTY
Which of the following was Rhodes Scholar ? ~ You # was Which of,HUM
Who comprised the now-defunct comic book team known as the Champions ? ~ Who comprised # comprised the defunct book team known,HUM
How do you make a paintball ? ~ How make # make you # make a paintball,DESC
What U.S. state is Fort Knox in ? ~ What is # is U.S. state,LOC
What is a female rabbit called ? ~ What is # is a female rabbit called,ENTY
Where is the highest point in Japan ? ~ Where is # is the highest point in,LOC
Where do chihuahuas come from ? ~ Where come # come chihuahuas,DESC
Where does Barney Rubble go to work after he drops Fred off in the `` Flintstones '' cartoon series ? ~ Where go # go Barney Rubble # drops he # drops Fred,LOC
What are the world 's four oceans ? ~ What are # are world four oceans,LOC
What 's the only work by Michelangelo that bears his signature ? ~ What 's # 's the only work by bears # bears that # bears his signature,ENTY
What is the largest snake in the world ? ~ What is # is the largest snake in,ENTY
In what medium is Stuart Hamblen considered to be the first singing cowboy ? ~ You # considered Stuart Hamblen,ENTY
Where on the Internet can I find a song lyrics database similar to the International Lyrics Server ? ~ Where find # find I # find a song lyrics database similar,LOC
How much money does a back injury lawsuit get ? ~ How much # does much money # get a injury lawsuit,NUM
What 's the common name for acetylsalicylic acid ? ~ What 's # 's the common name for,ENTY
What does the Georgetown `` Hoya '' mean ? ~ You # mean What # mean the Georgetown ` ` Hoya,DESC
Where can I find a list of `` classic '' books 5th and 6th graders should read ? ~ Where find # find I # find a list of # read 5th graders,LOC
Which two products use a tiger as their symbol ? ~ You # use Which two products # use a tiger as,ENTY
How is the election of a new Pope announced to the world ? ~ How is # announced the election of,DESC
How long does it take for your blood to make one complete trip through the body ? ~ How long # take it # make your blood # make one complete trip,NUM
How do chickens have baby chicks ? ~ How have # have chickens # have baby chicks,DESC
What is the historical relationship of Catholic Church and bingo ? ~ What is # is the historical relationship of,DESC
How was the element calcium named ? ~ How was # was the element calcium named,DESC
What crooner joined The Andrews Sisters for Pistol Packin Mama ? ~ You # joined What crooner # joined The Andrews Sisters for,HUM
What piano company claims its product is the `` Instrument of the immortals '' ? ~ You # claims What piano company # is its product,HUM
When did the Bounty mutiny take place ? ~ When take # take the Bounty mutiny # take place,NUM
What novel inspired the movie BladeRunner ? ~ You # inspired What novel # inspired the movie,ENTY
What is a transistor ? ~ What is # is a transistor,DESC
What is a film starring Jude Law ? ~ What is # is a film starring # starring Jude Law,ENTY
What Hollywood dog died in the arms of Jean Harlow in 1932 ? ~ You # died What # died Hollywood dog,ENTY
What are the most common elements in the Earth 's crust ? ~ What are # are the common elements in,ENTY
"How much would it cost to purchase a 2-foot-square party tent , with sides , ? ~ How much # cost How much # cost it # purchase a square party tent",NUM
What actress has received the most Oscar nominations ? ~ You # received What actress # received the most Oscar nominations,HUM
What are equity securities ? ~ What are # are equity securities,DESC
What is gymnophobia ? ~ What is # is gymnophobia,DESC
How many years do fossils take to form ? ~ How many # take fossils,NUM
Where is the Orinoco ? ~ Where is # is the Orinoco,LOC
What was the name of the `` Little Rascals '' dog ? ~ What was # was the name of,ENTY
"What city boasts Penn 's Landing , on the banks of the Delaware river ? ~ You # boasts What city # boasts Penn Landing",LOC
What Broadway musical was inspired by Cervantes 's Don Quixote ? ~ You # inspired What,ENTY
"What is the origin of the word , JJ . ~ What is # is the origin of",DESC
How many hostages were killed in the Entebbe raid ? ~ How many,NUM
How you can raise your IQ ? ~ How raise # raise you # raise your IQ,DESC
What does INRI stand for when used on Jesus ' cross ? ~ You # stand INRI,ABBR
Who produces Spumante ? ~ Who produces # produces Spumante,HUM
Who earns their money the hard way ? ~ Who earns # earns their money,HUM
Who founded the People 's Temple Commune ? ~ Who founded # founded People Temple Commune,HUM
What athlete makes the most money from sports merchandise sales ? ~ You # makes What athlete # makes the most money from,HUM
How many bends are there in a standard paper clip ? ~ How many,NUM
Who discovered electricity ? ~ Who discovered # discovered electricity,HUM
What part of your body contains the corpus callosum ? ~ You # contains What part of # contains the corpus callosum,ENTY
Who was the first American in space ? ~ Who was # was the first American in,HUM
What two South American countries do n't border Brazil ? ~ You # border What # border two American countries # border Brazil,LOC
What album put The Beatles on the cover of Time in 1967 ? ~ You # put What album # put The Beatles,ENTY
"What poem contains the line , `` grow old with me the best is yet to be '' . ~ You # contains What poem # contains the line # is the best",ENTY
What is a dental root canal ? ~ What is # is a dental root canal,DESC
What war did the Wanna-Go-Home Riots occur after ? ~ You # occur the Wanna - Go - Home Riots,ENTY
What is the busiest air travel season ? ~ What is # is the busiest travel season,NUM
What 's the colored part of the eye called ? ~ What 's # 's the colored part of called,ENTY
What are hook worms ? ~ What are # are hook worms,DESC
Where is the Rose Bowl played ? ~ Where is # played the Rose Bowl,LOC
Which Japanese car maker had its biggest percentage of sale in the domestic market ? ~ You # had Which Japanese car maker # had its biggest percentage of in,HUM
Who is the mayor of Marbella ? ~ Who is # is the mayor of,HUM
"What sun-blasted , 14-mile wide valley is just north of the Mojave desert ? ~ You # blasted What # is wide valley",LOC
In what year did Thatcher become prime minister ? ~ You # become Thatcher,NUM
How many months does it take the moon to revolve around the Earth ? ~ How many # take it # take the moon,NUM
Where are the 49 steps ? ~ Where are # are the 49 steps,LOC
In what year was De Gaulle elected president of France ? ~ You # elected De Gaulle # elected president of,NUM
Who sings the themes for `` Dawson 's Creek '' and `` Felicity '' ? ~ Who sings # sings the themes for and Felicity,HUM
Who directed `` Jaws '' ? ~ Who directed # directed ` ` Jaws '',HUM
On what T.V. show could Tom Terrific be found ? ~ You # show what,ENTY
What Indian tribe is F Troop perpetually doing battle with ? ~ You # is What Indian tribe # doing F Troop # doing battle,HUM
Where did Indian Pudding come from ? ~ You # come Indian Pudding,DESC
Why do some clothing labels say `` Use a nonchlorine bleach '' ? ~ Why say # say some clothing labels # Use a nonchlorine bleach,DESC
How many colonies were involved in the American Revolution ? ~ How many,NUM
What is the name of the city that Maurizio Pellegrin lives in ? ~ What is # is the name of # lives Maurizio Pellegrin,LOC
Where can I find pictorial directions on how to build a very simple treehouse ? ~ Where find # find I # find pictorial directions on # build a simple treehouse,LOC
"What game 's board shows the territories of Irkutsk , Yakutsk and Kamchatka ? ~ You # shows game board # shows the territories of",ENTY
What is the name of the managing director of Apricot Computer ? ~ What is # is the name of,HUM
What is the occupation of Nicholas Cage ? ~ What is # is the occupation of,HUM
Why do horseshoes bring luck ? ~ Why bring # bring horseshoes # bring luck,DESC
"What is the 401 , K , plan ? ~ What is # is the 401 , K # is , plan",DESC
What causes pneumonia ? ~ You # causes What # causes pneumonia,DESC
What are the three winter months in the southern hemisphere ? ~ What are # are the three winter months in,NUM
What does gringo mean ? ~ You # mean What # mean gringo,DESC
What country contains Africa 's northernmost point ? ~ You # contains What country # contains Africa northernmost point,LOC
What therapy attempts to elicit the `` primal scream '' ? ~ You # attempts What therapy # elicit the ` ` primal scream,ENTY
Where is the Kalahari desert ? ~ Where is # is the Kalahari desert,LOC
Which Ventura County police department seized the largest cocaine shipment in it 's history ? ~ You # seized County police department # seized the largest cocaine shipment in # 's it,HUM
What city is sometimes called Gotham ? ~ You # called Gotham,LOC
What dangles over the tongue from the palate ? ~ You,ENTY
Who created Dennis the Menace ? ~ Who created # created Dennis Menace,HUM
What dummy received an honorary degree from Northwestern University ? ~ You # received What dummy # received an honorary degree,HUM
When was the first Wall Street Journal published ? ~ When was # published the first Street Journal,NUM
What countries have the largest areas of forest ? ~ You # have What countries # have the largest areas of,LOC
How do I start a web based business ? ~ How start # start I # start a based business,DESC
Name Alvin 's brothers ~ You,HUM
What is Eagle 's syndrome styloid process ? ~ What is # is Eagle syndrome styloid process,DESC
How did Jayne Mansfield die ? ~ How die # die Jayne Mansfield,DESC
When did the royal wedding of Prince Andrew and Fergie take place ? ~ When take # take the royal wedding of # take place,NUM
What actor said in A Day at the Races : `` Either he 's dead or my watch has stopped '' ? ~ You # said What actor # 's he # stopped my watch,HUM
What explorer was nicknamed Iberia 's Pilot ? ~ You # nicknamed Iberia Pilot,HUM
CNN began broadcasting in what year ? ~ You # began CNN,NUM
What is a ball that hits the foul pole called ? ~ What is # is a ball hits # hits that # hits the foul pole called,ENTY
What makes hamburgers taste like steakburgers ? ~ You # makes What # taste hamburgers,DESC
Which company created the Internet browser Mosaic ? ~ You # created Which company # created the Internet browser,HUM
What are the rites accompanying the circumcision of a newly born-child in Judaism called ? ~ What are # are the rites accompanying # accompanying the circumcision of called,ENTY
What was the education system in the 1960 's ? ~ What was # was the education system in,ENTY
What South American city has the world 's highest commercial landing field ? ~ You # has What # has American city # has world highest commercial landing field,LOC
How can I find out which cities have cable-modem access ? ~ How find # find I # have which cities # have modem access,DESC
What is Betsy Ross famous for ? ~ What is # is Betsy Ross famous,DESC
How many species of sharks are there ? ~ How many # are many species of,NUM
What is `` snoogans '' ? ~ You # is What # is ` ` snoogans '',DESC
How many people are there in the world ? ~ How many # are many people,NUM
What shrubs can be planted that will be safe from deer ? ~ You # be that,ENTY
What organization 's offices were broken into at Watergate in 1972 ? ~ You,HUM
What is the design of the ship Titanic ? ~ What is # is the design of,DESC
What does S.O.S. stand for ? ~ You # stand S.O.S.,ABBR
Name a technique widely used to detect birth defects ? ~ You # Name a technique used # detect birth defects,ENTY
What is the daily requirement of folic acid for an expectant mother ? ~ What is # is the daily requirement of for,DESC
What is the `` 7-minute cigarette '' ? ~ What is # is the ` ` minute cigarette,DESC
What four forms does gold occur in ? ~ You # does What # does four forms # occur gold,ENTY
What is the acreage of the Chappellet vineyard ? ~ What is # is the acreage of,NUM
How do you correctly say the word ` qigong ' ? ~ How say # say you # say the word ` qigong,DESC
When did beethoven die ? ~ When beethoven,NUM
How much does a new railroad coal car cost ? ~ How much # cost How much # cost a new coal car,NUM
What two European countries entered the War of American Independence against the British ? ~ You # entered What # entered two European countries # entered the War of,LOC
What is the filmmakers collabrative ? ~ What is # collabrative the filmmakers,DESC
What Russian composer 's Prelude in C Sharp Minor brought him fame and fortune ? ~ You # brought What composer Prelude in Minor # brought him # brought fame and fortune,HUM
What caused Harry Houdini 's death ? ~ You # caused What # caused Houdini death,DESC
"Who was the mother of the man who would not be king , the duke of Windsor ? ~ Who was # was the mother of , duke # be who",HUM
How many revolutions does a standard LP make in three minutes ? ~ How many # make many revolutions,NUM
What is the name of the tallest mountain in the world ? ~ What is # is the name of,LOC
Where can I find a review of Nightmare on Elm Street in a film journal ? ~ Where find # find I # find a review of on,LOC
What 's the slowest Olympic swimming stroke ? ~ What 's # 's the slowest swimming stroke,ENTY
What was the name of the first Russian astronaut to do a spacewalk ? ~ What was # was the name of do # do a spacewalk,HUM
What disease is transmitted by the Anopheles mosquito ? ~ You,ENTY
What rum is so `` mixable '' it is a one-brand bar ? ~ You # is What rum # is it,ENTY
How many South American countries have the letter Z in their names ? ~ How many # have many American countries # have the letter Z,NUM
What is the contents of proposition 98 ? ~ What is # is the contents of,DESC
Where was George Washington born ? ~ Where born # born George Washington,LOC
"How many people on the ground were killed from the bombing of Pan Am Flight 103 over Lockerbie , Scotland , December 21 , CD . ~ How many",NUM
Who wrote NN DT NNP NNP '' ? ~ Who wrote # wrote NN DT NNP NNP,HUM
What is paracetamol ? ~ What is # is paracetamol,DESC
What are the powers and weaknesses of Green Lantern 's ring ? ~ What are # are the powers and weaknesses of,DESC
"Which mosquito 's bite draws blood , DT NN CC DT NN . ~ You # draws mosquito bite # draws blood",ENTY
When was the first steel mill in the United States built ? ~ When was # built the first steel mill in,NUM
What diminutive American female gymnast stole the show at the 1984 Olympics ? ~ You # stole What diminutive American female gymnast # stole the show,HUM
What is the origin of the name Katie ? ~ What is # is the origin of Katie,DESC
"What schools in the Washington , DC NN NN VBP NN NN NN NN . ~ You",HUM
When did the Berlin Wall go up ? ~ When go # go the Berlin Wall,NUM
Who is Terrence Malick ? ~ Who is # is Terrence Malick,HUM
What instrument is Ray Charles best known for playing ? ~ You,ENTY
"What 's the meaning of the Latin battle cry : Ad arma , ad arma . ~ What 's # 's the meaning of # 's Ad arma , arma",DESC
What is the mascot for Notre Dame University ? ~ What is # is the mascot for,ENTY
"What Las Vegas hotel burned in November , 1980 , with the loss of 84 lives ? ~ You # burned What # burned Vegas hotel",LOC
When did Mount St. Helen last have a significant eruption ? ~ When have # have Mount St. Helen # have a significant eruption,NUM
CNN is the abbreviation for what ? ~ You # is CNN,ABBR
When did World War I start ? ~ When start # did World War # start I,NUM
How many feet are there in a fathom ? ~ How many # are many feet,NUM
What is a Canada two-penny black ? ~ What is # is a Canada penny black,DESC
What European city do Nicois live in ? ~ You # live Nicois,LOC
How can I find out what year a Beanie Baby was introduced ? ~ How find # find I,DESC
What is the classic definition of tragic hero ? ~ What is # is the classic definition of,DESC
To what does Microsoft 's Windows 3 owe its success ? ~ You # owe what # owe Microsoft Windows 3 # owe its success,ENTY
Who was President of Afghanistan in 1994 ? ~ Who was,HUM
"What are other ways of getting stretch marks besides pregnancy , weight loss , and weight lifting ? ~ What are # are other ways of # getting stretch marks",ENTY
What did brontosauruses eat ? ~ You # eat What # eat brontosauruses,ENTY
What color bottles do good Rhine wines come in ? ~ You # do What color bottles # do good Rhine wines,ENTY
Who was the lead actress in the movie ` Sleepless in Seattle ' ? ~ Who was # was the lead actress in ` Sleepless,HUM
Who was the 16th President of the United States ? ~ Who was,HUM
Who are the two sons of Ozzie and Harriet Nelson ? ~ Who are # are the two sons of,HUM
What is molybdenum ? ~ What is # is molybdenum,DESC
When is Boxing Day ? ~ When Boxing # Boxing Day,NUM
