questions,classes
"What was Al Capone finally imprisoned for , in 1931 ? ~ What was # imprisoned Al Capone",DESC
What food can I use to catch a possum ? ~ You # use What food # use I # catch a possum,ENTY
What was Al Capone 's nickname ? ~ What was # was Capone nickname,HUM
Who was the author of the famous fairy tale `` Snow White and Seven Dwarfs '' ? ~ Who was # was the author of # was White Dwarfs '',HUM
What is the largest city in Germany ? ~ What is # is the largest city in,LOC
What is a fear of cholera ? ~ What is # is a fear of,ENTY
What park contains Firehole River and Fairy Falls ? ~ You # contains What park # contains Firehole River and Falls,LOC
What 's the largest island in the West Indies ? ~ What 's # 's the largest island in,LOC
What New England state carries the telephone area code 27 ? ~ You # carries What # carries England state # carries the area code 27,LOC
What is an example of a natural acid-base indicator ? ~ What is # is an example of,ENTY
In what county is Eckley Colorado ? ~ You # is what county # is Eckley Colorado,LOC
How do I find info about rice importers in the world ? ~ How find # find I # find info about,DESC
"How much does it cost to have a tree planted by dialing , 900 , 740-TREE ? ~ How much # cost How much # cost it # have a tree planted , TREE",NUM
What is the song Stairway to Heaven by Led Zeppelin about ? ~ What is # is the song Stairway to by about,DESC
How does hair curl ? ~ How curl # curl hair,DESC
What are pushed and coupled in hump yards ? ~ You,ENTY
How long do hermit crabs live ? ~ How long # live hermit crabs,NUM
What city hosted the first Winter Olympics in Asia ? ~ You # hosted What city # hosted the first Winter Olympics in,LOC
What is the origin of the first name ` Breony ' ? ~ What is # is the origin of,DESC
What month were you born in if your birthstone is sardonyx ? ~ You # is your birthstone,NUM
Who is behind the name of the Harvey Wallbanger drink ? ~ Who is,HUM
What is the origin of `` Beauty is in the eye of the beholder '' ? ~ What is # is the origin of # is Beauty,DESC
"What soft drink not only has its own video game , but was featured in its own Marvel comic book ? ~ You # has its own video game",ENTY
What oldtime kids ' fare did TV Guide writer Jeff Greenfield call `` one of the most...subversive TV shows in American history '' ? ~ You # did What kids fare # did Guide writer Greenfield call one,ENTY
Madonna advertises for what soft drink ? ~ You # advertises Madonna,ENTY
What does A&W of root beer fame stand for ? ~ You # stand A&W of,ABBR
What tennis term is said to come from the French word for egg ? ~ You,ENTY
What does a collier mine ? ~ You # mine What,ENTY
How much money can a person be fined for having a dog on a beach ? ~ How much # having a dog on,NUM
"What desert country borders Saudi Arabia , Iraq and the Persian Gulf ? ~ You # borders What desert country # borders Saudi Arabia , Iraq",LOC
What are the ages in comic book lingo ? ~ What are # are the ages in,ENTY
What kinds of animals are in Cambodia ? ~ You # are What kinds of,ENTY
What South African producer had a 1988 profit of $836 million ? ~ You # had What # had African producer # had a 1988 profit of,HUM
What American actress was the first to be called a `` vamp '' ? ~ What was # was American actress # called a ` ` vamp,HUM
What do the 12 days of Christmas mean ? ~ You # days What,DESC
"What John Steinbeck novel portrays the Joad family , driven from the Oklahoma dustbowl ? ~ You # portrays What # portrays Steinbeck novel # portrays the Joad family",ENTY
What date did man first land on the moon ? ~ You # did What date # did man first land on,NUM
Where are the headquarters of Eli Lilly ? ~ Where are # are the headquarters of,LOC
How many web servers are there ? ~ How many # are many web servers,NUM
What 's the last line of Dickens 's A Christmas Carol ? ~ What 's # 's the last line of,DESC
How many trees go into paper making in a year ? ~ How many # go many trees,NUM
Where can I find info on research being done on oilseeds thru genetics ? ~ Where find # find I # find info on done,LOC
How come light bulbs go out ? ~ How go # go light bulbs,DESC
For what reason did the Shea & Gould law firm close their L.A. office ? ~ You # close the Shea law firm # close their L.A. office,DESC
How far out is the universe ? ~ How far # is the universe,NUM
What is the difference between a bottle and a jar ? ~ What is # is the difference between,DESC
What disease is the second-biggest killer of North Americans ? ~ You # is What disease,ENTY
Where did the Mayan Indians live ? ~ Where live # live the Mayan Indians,LOC
Where was Poe born ? ~ Where born,LOC
What happens to the female body with lack of sleep and food ? ~ You # happens What,DESC
What is a fear of crystals or glass ? ~ What is # is a fear of,ENTY
Name a product that controls the ripening of apples . ~ You # Name a product controls # controls that # controls the ripening of,ENTY
How many warmup pitches does a reliever get coming into a baseball game ? ~ How many # does many warmup pitches # coming a reliever,NUM
Where did Dylan Thomas die ? ~ Where die # die Dylan Thomas,LOC
What common livestock have the greatest variety of breeds ? ~ You # have What common livestock # have the greatest variety of,ENTY
What film had Bette Davis creating a scandal by wearing a daring red gown to a society ball ? ~ You # creating What film # creating Bette Davis # creating a scandal # wearing a daring red gown to,ENTY
What disease did August von Wassermann develop a specific test for in 196 ? ~ You # did What disease # develop von Wassermann # develop a specific test,ENTY
What card company sells Christmas ornaments ? ~ You # sells What card company # sells Christmas ornaments,HUM
How do I find out what cities are in a certain area code ? ~ How find # find I # are cities,DESC
What can communications satellites offer yachts ? ~ You # offer What # offer communications satellites # offer yachts,ENTY
How many Fig Newtons are there to the pound ? ~ How many # are many Fig Newtons,NUM
Who is the premier of China ? ~ Who is # is the premier of,HUM
What cigar-chewing comedian observed : `` You 're only as old as the woman you feel '' ? ~ You # observed What chewing comedian # 're You # feel you,HUM
How many bones are there in the human hand ? ~ How many # are many bones,NUM
What bread company used to feature stickers of the Cisco Kid on the ends of their packages ? ~ You # used What bread company # feature stickers of,HUM
Who was the president of Vichy France ? ~ Who was # was the president of,HUM
Whose kidnaping was termed The Crime of the Century ? ~ You # termed The Crime of,HUM
What is hydrogen ? ~ What is # is hydrogen,DESC
What group asked the musical question Do You Believe in Magic ? ~ You # asked What group # asked the musical question # Believe You,HUM
What was the tallest building in America in 1922 ? ~ What was # was the tallest building in in,LOC
What buxom blonde appeared on the cover of more than 5 magazines ? ~ You # appeared What buxom blonde,HUM
What is recruitment interview technique ? ~ What is # is interview technique,DESC
How does a hurricane form ? ~ How form,DESC
What does the donation process entail ? ~ You # entail What # entail the donation process,DESC
How far is it from Phoenix to Blythe ? ~ How far # is it,NUM
What New Hampshire hamlet rises early to vote first in U.S. presidential elections ? ~ You # rises What # rises Hampshire hamlet,LOC
How many people watch network television ? ~ How many # watch many people # watch network television,NUM
"What garment was named for Bradley , Voorhees and Day ? ~ You",ENTY
Who first broke the sound barrier ? ~ Who broke # broke the sound barrier,HUM
How do birds have sex ? ~ How have # have birds # have sex,DESC
How many horses are there on a polo team ? ~ How many # are many horses,NUM
What 's destroyed in Genesis 19 : 24 ? ~ You,ENTY
What new year is celebrated on February 16th ? ~ You,ENTY
What is Occam 's Razor ? ~ What is # is Occam Razor,DESC
Where do the Grimace and Mayor McCheese live ? ~ Where live # live the Grimace McCheese,LOC
How long does it take to hike the entire Appalachian Trail ? ~ How long # take it # hike the entire Appalachian Trail,NUM
What role do fruits play in the survival of plants ? ~ You # play What role # play fruits,HUM
Where is the world championship sled dog race held each February ? ~ Where held # sled the world championship # held sled dog race,LOC
What are the medical purposes of `` clitoridectomy '' ? ~ What are # are the medical purposes of,DESC
How is thalassemia defined ? ~ How defined,DESC
What 's the name of the Tampa newspaper ? ~ What 's # 's the name of,ENTY
What is a storm surge ? ~ What is # is a storm surge,DESC
How do you use `` farther '' as opposed to `` further '' ? ~ How use # use you # use farther '',DESC
What was the alternate to VHS ? ~ What was # was the alternate to,ENTY
What is one of the languages of the Sioux ? ~ What is # is one of,ENTY
What Pulitzer Prize-winning novelist ran for mayor of New York City ? ~ You # ran What # ran winning novelist,HUM
How many times can a nickel-cadmium rechargeable battery be recharged ? ~ How many,NUM
How is cologne made ? ~ How made # made cologne,DESC
What was the food of the Greek gods called ? ~ What was # was the food of,ENTY
What does camera-ready art mean ? ~ You # mean What # mean ready art,DESC
How many seats does the Batmobile sport ? ~ How many # does many seats # does the Batmobile sport,NUM
How many cards are dealt to each player in Gin Rummy ? ~ How many,NUM
What happened to Phillip Taylor Kramer ? ~ You # happened What,DESC
What Erica Jong novel deals with Isadora Wing 's fear ? ~ You # deals What,ENTY
What time of year do most people fly ? ~ You # do What time of # fly most people,NUM
Who was Scrooge 's dead partner in Dickens 's A Christmas Carol ? ~ Who was # was Scrooge dead partner in,HUM
What is the origin of the Christmas tree ? ~ What is # is the origin of,DESC
When is the Thai New Year ? ~ When is # is the Thai New Year,NUM
What four tournaments make up tennis ' Grand Slam ? ~ You # make What # make four tournaments # make tennis Grand Slam,ENTY
What 1964 film introduced the song My Kind of Town ? ~ You # introduced What # introduced 1964 film # introduced the song,ENTY
Who recorded the 1957 hit Tammy ? ~ Who recorded # recorded the 1957 # hit Tammy,HUM
What is the term for the side of the mountain that faces the prevailing winds ? ~ What is # is the term for # faces that # faces the prevailing winds,ENTY
"In Kafka 's Metamorphosis , the hero awakes one morning to find himself turned into what ? ~ You # awakes the hero # awakes one morning # turned himself",ENTY
What does caliente translate to in English ? ~ You # caliente What # caliente translate,ENTY
Who is Mia Farrow 's mother ? ~ Who is # is Farrow mother,HUM
How do you determine if a computer monitor has an SVGA adapter ? ~ How determine # determine you # has a computer monitor # has an SVGA adapter,DESC
How far can a human eye see ? ~ How far # see a human eye,NUM
What time of year has the most air travel ? ~ You # has What time of # has the air travel,NUM
What does the term `` spaghetti western '' mean ? ~ You # mean What # mean the term,DESC
When was the G7 group of nations formed ? ~ When was # formed the G7 group of,NUM
What are differences between 1980 and 1990 ? ~ What are # are differences between,DESC
What baseball player was walked the most times ? ~ You,HUM
What famous male vocalist has the same name as the composer of the opera Hansel and Gretel ? ~ You # has What famous male vocalist # has the same name as,HUM
What were the first frozen foods ? ~ What were # were the first frozen foods,ENTY
Why is Indiglo called Indiglo ? ~ Why called # called Indiglo,DESC
What is the word for love of pain or abuse ? ~ What is # is the word for,ENTY
When did they canonize the Bible ? ~ When canonize # canonize they # canonize the Bible,NUM
Who was the only president to serve two nonconsecutive terms ? ~ Who was # serve two nonconsecutive terms,HUM
What percentage of all world tornados touch down in the US ? ~ You # touch What percentage of,NUM
What labor leader was last seen in the parking lot of a Michigan restaurant ? ~ You,HUM
When did the Carolingian period begin ? ~ When begin # begin the Carolingian period,NUM
What motto ended Merrie Melodies cartoons ? ~ You # ended What motto # ended Melodies cartoons,DESC
Who reports the weather on the `` Good Morning America '' television show ? ~ Who reports # reports the weather on,HUM
How many emperors were there in the Roman Empire ? ~ How many # were many emperors,NUM
What was the name of `` The Muppets '' creator ? ~ What was # was the name of,HUM
What is Cabarnet Sauvignon ? ~ What is # is Cabarnet Sauvignon,DESC
What is a virtual IP address ? ~ What is # is a virtual IP address,DESC
What 's the name of the tiger that advertises for Frosted Flakes cereal ? ~ What 's # 's the name of # advertises that,ENTY
"Who sent the brief message `` I came , I saw , I conquered '' ? ~ Who sent # sent the brief message # came I # saw I # conquered I",HUM
What color is Mr. Spock 's blood ? ~ You,ENTY
What U.S. Air Force general led the first bombing raid over Tokyo ? ~ You # led What # led Force general # led the first bombing raid over,HUM
What U.S. vice-president said : `` Some newspapers dispose of their garbage by printing it '' ? ~ You # said What # said U.S. vice # said - # said president # dispose Some newspapers # printing it,HUM
"What was the name of the first Watergate special prosecutor , later fired by Nixon ? ~ What was # was the name of",HUM
How do movie blues screens work ? ~ How work # work blues screens,DESC
How does the speed the magnet spins in a generator affect the output of the generator ? ~ How affect # affect the speed spins # spins the magnet # affect the output of,DESC
What 's the supreme policy-making bureau of the Soviet Communist Party ? ~ What 's # 's the supreme making bureau of,HUM
What was the Vietnam War ? ~ What was # was the Vietnam War,DESC
What is La Nina ? ~ What is # is La Nina,DESC
Why did the Globe Theatre burn down ? ~ Why burn # burn the Globe Theatre,DESC
On what day were John F and Jackie Kennedy married ? ~ You # married John F and Kennedy,NUM
"What was the non-fiction best-seller of 1952 , 1953 and 1954 ? ~ What was # was the non - fiction best - seller of , 1953",ENTY
What is meant by blood SED rate ? ~ You,DESC
Who are the nomadic hunting and gathering tribe of the Kalahari Desert in Africa ? ~ Who are # gathering tribe of,HUM
Who won a Pulitzer Prize for his novel The Caine Mutiny ? ~ Who won # won a Pulitzer Prize,HUM
What 's the best way to lose the flab under your chin and around your face ? ~ What 's # 's the best way lose # lose the flab,ENTY
Where is your corpus callosum ? ~ Where is # is your corpus callosum,LOC
"What Broadway musical featured the song , `` If I were a rich man ? '' ~ You # featured What # featured Broadway musical # featured the song # were I",ENTY
Who portrayed Sherlock Holmes in 14 films between 1939 and 1946 ? ~ Who portrayed # portrayed Sherlock Holmes,HUM
Why is the development of space so important ? ~ Why is # is the development of important,DESC
What is the nursery rhyme Rock-a-by Baby about ? ~ What is # is nursery rhyme by,DESC
"When Superman needs to get away from it all , where does he go ? ~ When needs # needs Superman # go he",LOC
How old is singer Freedy Johnston ? ~ How old # is singer Freedy Johnston,NUM
What is the origin of gametophytic tissue ? ~ What is # is the origin of,DESC
What does Aaron mean ? ~ You # mean What # mean Aaron,DESC
What is a fear of hair ? ~ What is # is a fear of,ENTY
What is the name of the pop singer whose song became the theme song for a brand of catsup ? ~ What is # is the name of # became whose song,HUM
What is a conifer ? ~ What is # is a conifer,DESC
Who claimed to be the world 's most perfectly-developed man ? ~ Who claimed,HUM
What is different about the red and black fox ? ~ You # is What,DESC
What is e-commerce ? ~ What is # is e,DESC
How do I tie a tie ? ~ How tie # tie I # tie a tie,DESC
Where can I get cotton textiles importer details ? ~ Where get # get I # get textiles importer details,LOC
When did Spain and Korea start ambassadorial relations ? ~ When start # start Spain and Korea # start ambassadorial relations,NUM
What kind of people took part in Shays ' Rebellion in Massachusetts in 1787 ? ~ You # took What kind of # took part,HUM
What is chromatology ? ~ What is # is chromatology,DESC
How many grooves are on a dime 's edge ? ~ How many # are many grooves,NUM
How was the ACLU formed ? ~ How formed,DESC
What are the most albums sold by one artist or band ? ~ What are # are the most albums sold,ENTY
The second most popular sport worldwide is what ? ~ You # is The second popular sport worldwide,ENTY
What do goldfish lose if kept in dimly-lit or running water ? ~ You # lose What # kept lit water,ENTY
What canal does the Thatcher Ferry Bridge span ? ~ You # span What canal,LOC
What American won the world Grand Prix driving championship in 1978 ? ~ You # won American # won the world # won Prix driving championship,HUM
What are the chances of pregnacy if the penis does not penetrate the vagina ? ~ What are # are the chances of # penetrate the penis # penetrate the vagina,NUM
What 's the highest hand in straight poker ? ~ What 's # 's the highest hand in,ENTY
Where can I find a lesson plan for teaching the metric system conversion to American standard ? ~ Where find # find I # find a lesson plan for # teaching the system conversion to,LOC
What is the name of Kevin Costner 's movie about Sioux Indians ? ~ What is # is the name of,ENTY
"What are Kythnos , Siphnos , Seriphos and Mykonos ? ~ What are # are Kythnos , Siphnos",DESC
Name a female figure skater . ~ You # Name a female figure,HUM
Why are there no white lines on pro footballs ? ~ Why are,DESC
How long would it take for a $ savings bond to mature ? ~ How long # take it # mature a $ savings bond,NUM
How is Abigail Arcane related to the villainous opponent of the Swamp Thing ? ~ How is # related Abigail Arcane,DESC
What did the Congress of Vienna establish ? ~ You # establish What # establish the Congress of,ENTY
What is the average cost for four years of medical school ? ~ What is # is the average cost for,NUM
What harmful chemicals are in bug spray ? ~ You # are What harmful chemicals,ENTY
How many spears are there on Kenya 's flag ? ~ How many # are many spears,NUM
What did Mighty Mouse always sing as he went into action ? ~ You # sing What # sing Mighty Mouse # went he,DESC
Where did George of the Jungle live ? ~ Where live # live George of,LOC
How did Bob Marley die ? ~ How die # die Bob Marley,DESC
What 's men 's par on a 455-yard golf hole ? ~ What 's # 's men par on,NUM
What percentage of American men are alcoholic ? ~ You,NUM
"Dialing , 900 , 740-TREE to have a tree planted will cost how much ? ~ You # cost Dialing , 900 TREE have # have a tree planted # cost how much",NUM
"In South Korea , how many American Soldiers are there ? ~ You # are many American Soldiers",NUM
Who portrayed Carl Bernstein in All the President 's Men ? ~ Who portrayed # portrayed Carl Bernstein,HUM
What are the numbers that fit into Fermont 's last theorem ? ~ What are # are the numbers fit # fit that,NUM
Who was Tiny Tim 's father ? ~ Who was,HUM
What does a heliologist study ? ~ You # study What,ENTY
Who was Bonnie Blue Butler 's father ? ~ Who was,HUM
"What shampoo prevents eczema , seborrhea , and psoriasis ? ~ You # prevents What shampoo # prevents eczema , seborrhea",ENTY
How many Americans have HIV ? ~ How many # have many Americans # have HIV,NUM
Where do I find information for foreclosure properties on the Internet ? ~ Where find # find I # find information for on,LOC
Who is the Antichrist ? ~ Who is # is the Antichrist,HUM
What was the first English play written exclusively for children ? ~ What was # was the first English play written,ENTY
Which Latin American country is the largest ? ~ You # is Which American country,LOC
What was the former residence of Scottish kings in Edinburgh ? ~ What was # was the former residence of in,LOC
How many teats does a female goat sport ? ~ How many # does many teats # does a female goat sport,NUM
How tall is kilamanjaro ? ~ How tall # is kilamanjaro,NUM
Who was the lawyer who represented Randy Steven Craft ? ~ Who was # was the lawyer represented # represented who # represented Randy Steven Craft,HUM
What country buys 25 percent of the world 's tea exports ? ~ You # buys What country # buys 25 percent of,LOC
What country is the origin of the band the Creeps ? ~ You,LOC
What did the crocodile swallow in Peter Pan ? ~ You # swallow What,ENTY
What is the origin of the word `` mushroom '' ? ~ What is # is the origin of,DESC
Which of the following celebrities was not born in Philadelphia ? ~ You,HUM
What is the number of American soldiers deployed to South Korea ? ~ What is # is the number of,NUM
Where is the biggest bell ? ~ Where is # is the biggest bell,LOC
What is the brand name of the chemical daminozide ? ~ What is # is the brand name of,ENTY
How do microwaves work ? ~ How microwaves # microwaves work,DESC
What magazine paid Ernest Hemingway $15 a word to write a bullfighting article ? ~ You # paid What magazine # paid Ernest Hemingway # paid $ 15 word # write a bullfighting article,ENTY
What is the estimated total U.S. whitetail deer population ? ~ What is # is the estimated total deer population,NUM
Who wrote the Farmer 's Almanac ? ~ Who wrote # wrote Farmer Almanac,HUM
"What animal received royal assent as an emblem of Canada on March 24 , 1975 ? ~ You # received What animal # received royal assent",ENTY
What number is at 12 o 'clock on a dartboard ? ~ You # is What number,NUM
Which team won the Super Bowl in 1968 ? ~ You # won Which team # won the Super Bowl,HUM
What is the recommended daily requirement for folic acid for pregnant women ? ~ What is # is the recommended daily requirement for for,DESC
What film dramatized the Scopes monkey trial ? ~ You # dramatized What film # dramatized the Scopes monkey trial,ENTY
CNN is owned by whom ? ~ You,HUM
What country offered Albert Einstein its presidency in 1952 ? ~ You # offered What country # offered Albert Einstein presidency,LOC
What is the HIGHEST Roman numeral ? ~ What is # is HIGHEST Roman,DESC
"What TV series saw many of its aquatic scenes shot at Silver Springs , Florida ? ~ You # saw What # saw TV series # saw many of",ENTY
Who was the 15th century fire-and-brimstone monk who gained control of Florence but ended burnt at the stake ? ~ Who was # was fire monk gained # gained who # gained control of,HUM
How is digital audio used ? ~ How is # used digital audio,DESC
What is AFS ? ~ What is # is AFS,ABBR
Who was Quetzalcoatl ? ~ Who was,HUM
What operating system do IBM-compatible machines use ? ~ You # do What operating system # use compatible machines,ENTY
What French leader sold Louisiana to the United States ? ~ You # sold What French leader # sold Louisiana # sold to States,HUM
"What bay sparkles next to Miami , Florida ? ~ You # sparkles What bay",LOC
How many miles of veins are in the circulatory system ? ~ How many # are many miles of,NUM
What famed river flows through Bagdad ? ~ You # flows What famed river,LOC
How is bubble wrap made ? ~ How made # made bubble wrap,DESC
What is Java ? ~ What is # is Java,DESC
Who is the prime minister of Japan ? ~ Who is # is the prime minister of,HUM
What player squats an average of 3 times during a baseball doubleheader ? ~ You # squats What player # squats an average of,HUM
What 's the most common name in nursery rhymes ? ~ What 's # 's the common name in,HUM
How many `` No '' answers was the What 's My Line ? panel allowed ? ~ How allowed # was many allowed ` ? ` No '' answers # 's My Line # allowed panel,NUM
What is the fine for having a dog on a beach ? ~ What is # is the fine for # having a dog on,NUM
"Who wrote the book , `` Song of Solomon '' ? ~ Who wrote # wrote the book # wrote Song of",HUM
"Where can one find information on religion and health , the brain and nutrition ? ~ Where find # find one # find information on",LOC
Name the Ranger who was always after Yogi Bear . ~ You # Name the Ranger was # was who,HUM
What TV show did John Sebastian sing the theme for ? ~ You # did What TV show # sing John Sebastian # sing the theme,ENTY
Who is the president of the Spanish government ? ~ Who is # is the president of,HUM
Who holds the career record for the most major league home runs ? ~ Who holds # holds the career record for,HUM
Which of the following actors worked in New York 's Yiddish Theater ? ~ You # worked Which of,HUM
Who invented the stethoscope ? ~ Who invented # invented the stethoscope,HUM
What is a mathematical factor ? ~ What is # is a mathematical factor,DESC
How many four star generals were there and who are they ? ~ How many # were many four star generals # are they,NUM
When did Nixon die ? ~ When die # die Nixon,NUM
What was originally defined as one 1-millionth of the distance from the equator to the Pole ? ~ You,ENTY
What comedian hit the TV screen in 1951 with the NBC afternoon show Time for Ernie ? ~ You # hit What comedian # hit the TV screen,HUM
How many members are in the California congressional delegation ? ~ How many # are many members,NUM
What erupts every hour at Yellowstone National Park ? ~ You # erupts What,LOC
What country contains the highest point in South America ? ~ You # contains What country # contains the highest point in,LOC
What are Arnold Palmer 's fans called ? ~ What are # called Palmer fans,HUM
Who retired with 755 home runs to his credit ? ~ Who retired,HUM
What constellation represents a hunter with club and shield ? ~ You # represents What constellation # represents a hunter with,LOC
Who developed potlatch ? ~ Who developed # developed potlatch,HUM
